id,title,selftext,score,num_comments,author,created_utc,url,upvote_ratio,over_18,edited,spoiler,stickied
1lk6ihx,Using federation for data movement?,"Wondering if anyone has used federation for moving data around. I know it doesn't scale for hundreds of millions of records but what about for small data sets?

This avoid the tedious process creating an etl in airflow to export from mssql to s3 and then loading to databricks staging. And it's all in SQL which we prefer over python.

Main questions are around cost and performance

**Example flow:**

On Databricks, read lookup table from mssql using federation and then merge it into a table on Databricks.

**Example flow 2:**

\* on databricks, read a large table (100M) but with a filter on last\_updated (indexed field) based on last import. this filter is pushed down to mssql so it should run fast. this only brings in 1 million records. which merges into the destination table on deltalake

\* [https://docs.aws.amazon.com/redshift/latest/dg/federated-overview.html](https://docs.aws.amazon.com/redshift/latest/dg/federated-overview.html)  
\* [https://docs.databricks.com/aws/en/query-federation/](https://docs.databricks.com/aws/en/query-federation/)",2,3,gman1023,2025-06-25 14:02:16,https://www.reddit.com/r/dataengineering/comments/1lk6ihx/using_federation_for_data_movement/,0.76,False,1750879107.0,False,False
1lkgmj3,Database design. Relationship,"Hello,  
I will start that I am completely new with databases and their design. (some theory but no real experience)

I was looking quit a lot but there is no one best way for my scenario.

I will give some content of data I have:   
Devices <> DeviceType(printer, pc, phones, etc) <> DeviceModel <> Cartridge(type-printer, model-x)  
Also I want so every DeviceType will has its own spec (PrinterSpec, PhoneSpec, etc).  
I am not sure what relationship to choose. I want it to be possible to add device type later (here comes DeviceSpec also).  
There is also a lot more information I want to add, but seems there is no problem (User, Role, Department, Manufacturer, Location, Room, AccetPurchase, Assignment, Maintenance).  
Database will be kinda verry small (\~500 devices).  
Initial idea to use data for internal device management system. But things change fast, so want it to be upgradable. Probably with only that number of entries its not so hard to recreate (not for me, but in general).",2,1,Mostdeath,2025-06-25 20:29:43,https://www.reddit.com/r/dataengineering/comments/1lkgmj3/database_design_relationship/,1.0,False,False,False,False
1lkakxl,Dbt type 2 tables,"If I have a staging, int, and mart layers, which layer should track data changes? The stg layer (build off snapshots), or only the dim/fct tables in the mart? What is best practice for this?",1,4,plantsstampslamps,2025-06-25 16:38:54,https://www.reddit.com/r/dataengineering/comments/1lkakxl/dbt_type_2_tables/,0.67,False,False,False,False
1lk4drr,How to avoid Bad Data before it breaks your Pipeline with Great Expectations in Python ETL…,"Ever struggled with bad data silently creeping into your ETL pipelines?

I just published a hands-on guide on using Great Expectations to validate your CSV and Parquet files before ingestion. From catching nulls and datatype mismatches to triggering Slack alerts — it's all in here.

If you're working in data engineering or building robust pipelines, this one’s worth a read",0,0,sshetty03,2025-06-25 12:30:45,https://medium.com/@subodh.shetty87/how-to-bad-data-before-it-breaks-your-pipeline-with-great-expectations-in-python-etl-workflows-f7d191b5aa03,0.5,False,False,False,False
1ljte6w,"do you load data from ETL system to both database and storage? if yes, what kind of data you load to storage?","I design the whole pipeline when gathering data from ETL system before loading to Databricks, many articles said you should load data to database then load to storage before loading to Databricks platform which storage is for cold data that's not updated frequently, history backup, raw data like JSON Parquet, processed data from DB. is that best practice to do it? ",1,13,BBHUHUH,2025-06-25 01:50:34,https://www.reddit.com/r/dataengineering/comments/1ljte6w/do_you_load_data_from_etl_system_to_both_database/,0.57,False,False,False,False
1ljwjaw,Curious about next steps as a mid career DE: Cert or Projects,"Unfortunately my contract ended so I’ve been laid off again. This is my second layoff in about 8 months. My first one was in Nov 2024. I’ve been IT about 8 years and 4 in data specifically. 
I’m not sure what I may need to do next and wanted to gather feedback. 
I know most recruiters care about experience over certs and degrees, roughly. I know degrees and certs can be either or. But I have a Masters degree and SQL certification. I wanted to know which would be more beneficial to get another cert or do projects. I know projects are to show expertise but I have several years of experience I can speak too. 
So my question is which will be the most beneficial. Or do I just have to wait for an opportunity. Any tips are appreciated. ",0,4,hijkblck93,2025-06-25 04:34:27,https://www.reddit.com/r/dataengineering/comments/1ljwjaw/curious_about_next_steps_as_a_mid_career_de_cert/,0.5,False,False,False,False
1ljwhsq,Data Engineer Looking to Upskill in GenAI — Anyone Tried Summit Mittal’s Course?,"**Hi everyone,**

As we all know, GenAI is rapidly transforming the tech landscape, and I’m planning to upskill myself in this domain.

I have around 4 years of experience in data engineering, and after some research, the **Summit Mittal GenAI Master Program** caught my attention. It seems to be one of the most structured courses available, but it comes with a hefty price tag of ₹50,000.

Before I commit, I’d love to hear from those who’ve actually taken this course:

* Did it truly help you land better career opportunities?
* Does it offer real-world, industry-relevant projects and skills?
* Was it worth the investment?

Also, if you’ve come across **any other high-value or affordable courses (or even YouTube resources)** that helped you upskill in GenAI effectively, please do share your recommendations.

Your feedback would mean a lot—thanks in advance!",0,9,Physical_Shelter_285,2025-06-25 04:32:06,https://www.reddit.com/r/dataengineering/comments/1ljwhsq/data_engineer_looking_to_upskill_in_genai_anyone/,0.5,False,False,False,False
1lkch21,dbt environments,"Can someone explain why dbt doesn't recommend a testing environment? In the documentation they recommend dev and prod, but no testing?",0,5,Icy-Western-3314,2025-06-25 17:49:37,https://www.reddit.com/r/dataengineering/comments/1lkch21/dbt_environments/,0.4,False,1750875081.0,False,False
1lk9ilw,Production data pipelines 3-5× faster using Claude + Keboola’s built-in AI agent interface,"[An example of Claude fixing a job error.](https://i.redd.it/fgdaw8ptp19f1.gif)

*We recently launched full AI assistant integration inside our data platform (Keboola), powered by the* [Model Context Protocol (MCP)](https://help.keboola.com/ai/mcp-server/). It’s now live and already helping teams move 3-5x faster from spec to working pipeline.  
  
Here’s how it works

**1. Prompt**

 I ask Claude something like:

>1. Pull contacts from my Salesforce CRM.  
2. Pull my billing data from Stripe.  
3. Join the contacts and billing and calculate LTV.  
4. Upload the data to BigQuery.  
5. Create a flow based on these points and schedule it to run weekly on Monday at 7:00am my time.

**2. Build**  
The AI agent connects to our Keboola project (via OAuth) using the Keboola MCP server, and:  
– creates input tables  
– writes working SQL transformations  
– sets up individual components to extract data from or write into, which can be then connected into  fully orchestrated flows.  
– auto-documents the steps

**3. Run + Self-Heal**  
The agent launches the job and monitors its status.  
If the job fails, it doesn’t wait for you to ask - it automatically analyzes logs, identifies the issue, and proposes a fix.  
If everything runs smoothly, it keeps going or checks in for the next action.  
  
**What about control & security?**  
Keboola stays in the background. The assistant connects via scoped OAuth or access tokens, with no data copied or stored.  
You stay fully in charge:  
– Secure by design  
– Full observability  
– Governance and lineage intact  
So yes - you can vibe-code your pipelines in natural language… but this time with trust.  
  
**The impact?**  
*In real projects, we’re seeing a 3-5x acceleration in pipeline delivery — and fewer handoffs between analysts, engineers, and ops.*  
  
**Curious** if others are giving LLMs access to production tooling.  
**What workflows have worked (or backfired) for you?**

**Want to try it yourself?** Create your first project[ here](https://connection.us-east4.gcp.keboola.com/wizard?utm_campaign=MCP_launch&utm_source=reddit&utm_medium=post&utm_content=reddit).",0,2,keboola,2025-06-25 15:59:22,https://www.reddit.com/r/dataengineering/comments/1lk9ilw/production_data_pipelines_35_faster_using_claude/,0.29,False,False,False,False
1lk35s6,Why You Need a Data Lakehoue?,"# Background to the introduction of Paimon and the main issues addressed

**1. Offline Timeliness Bottlenecks**

From the internal applications shared by various companies, most of the scenarios are Lambda architecture at the same time. The biggest problem of offline batch processing architecture is storage and timeliness. Hive itself has limited capability on storage, most of the scenarios are **INSERT OVERWRITE**, and basically do not care about the file organization form.

Paimon on behalf of the lake framework can be fine management of each file, in addition to simple **INSERT OVERWRITE**, with a more powerful ACID capabilities, can stream write to achieve minute-level updates.

**2. Real-Time Pipeline Headaches**

**Flink + MQ-based real-time pipeline, the main problems include:**

1. Higher cost, numerous technology stacks around Flink, high management and operation and maintenance costs; and because the intermediate results do not land, a large number of dump tasks are needed to assist in problem localization and data repair;
2. task stability, stateful computation leads to delays and other problems;
3. intermediate results do not land, a large number of auxiliary tasks are needed to assist in troubleshooting problems.

So we can qualitatively give Paimon to solve the problem of a conclusion: unify the flow batch link, improve the time and reduce costs at the same time.

# Core scenarios and solutions

**1. Unified Data Ingestion (Upgrading ODS Layers)**

In the sharing of major companies, it is mentioned about using Paimon instead of the traditional Hive ODS layer, and Paimon is used as the unified mirror table of the whole business database to improve the timeliness of the data link and optimize the storage space.

The actual production link brings the following benefits:

1. In the traditional offline and real-time links, ODS is carried by Hive table and MQ (usually Kafka) respectively, in the new link Paimon table is used as a unified storage for ODS, which can satisfy both streaming and batch reads;
2. After adopting Paimon, since the whole link is quasi-real-time, the processing time can be shortened from hourly to minute level, usually controlled within ten minutes;
3. Paimon has good support for concurrent write operations, and Paimon supports both primary and non-primary key tables;

It is worth mentioning here that Shopee has developed a Paimon Branch-based “day-cut function”. Simply put, the data is sliced according to the day, avoiding the problem of redundant storage of data in the full-volume partition.

In addition, the Paimon community also provides a set of tools that can help you carry out schema evolution, synchronize MySQL or even Kafka data to Paimon, and add columns upstream, the Paimon table will also follow the increase in columns.

**2. Dimension Tables for Lookup Joins**

Paimon primary key table as a dimension table scenario, there are mature applications in major companies, the actual production environment has been tested many times.

Paimon as a dimension table scenarios are divided into two categories, one is the real-time dimension table: through the Flink task to pick up the business database real-time updates; the other is the offline dimension table, that is, through the Spark offline task T +1 update, is also the vast majority of data scenarios of the dimension table.

Paimon dimension table can also support Flink Streamin SQL tasks and Flink Batch tasks.

**3. Paimon Building Wide Tables**

Paimon and many other frameworks, support Partial Update, LSM Tree architecture makes Paimon has a very high point checking and merging performance, but here to pay special attention to a few points:

Performance bottlenecks, in the ultra-large-scale data update or ultra-multi-column update scenarios, the background merger performance will have a significant decline, need to be careful to test the use of;

Sequence Group sorting, when the business has more than one stream for the splicing, will be given to each stream definition of a separate Sequence Group, the Sequence Group sorting fields need to be reasonably selectable, and even have more than one field sorting, the Sequence Group will have to be used in the same way as the other frameworks. There will even be multiple field sorting;

**4. PV/UV Tracking**

In the example of PayPal calculating PV/UV metrics, it was previously implemented using Flink's full stateful links, but then it was found difficult to migrate a large number of operations to this model, so it was replaced with Paimon.

Paimon's upsert (update or insert) update mechanism is utilized for de-duplication, and Paimon's lightweight logging, changlog, is used to consume the data and provide real-time PV (Page View) and UV calculations downstream.

In terms of overall resource consumption, the Paimon solution resulted in a 60% reduction in overall CPU utilization, while checkpoint stability was significantly improved. Additionally, because Paimon supports point-to-point writes, task rollback and reset times are dramatically reduced. The overall architecture has become simpler, and therefore a reduction in business development costs has been realized.

**5. Lakehouse OLAP Pipelines**

Because of the high degree of integration between Spark and Paimon, some ETL operations are performed through Spark or Flink, data is written to Paimon, z-order sorting, clustering, and even building file-level indexes based on Paimon, and then OLAP queries are performed through Doris or StarRocks, so that the full link can be achieved! OLAP effect.

# Summary

Basically, the above content is the major companies to land the main scene, of course, there are some other scenarios we will continue to add.",0,29,dyzcs,2025-06-25 11:28:34,https://www.reddit.com/r/dataengineering/comments/1lk35s6/why_you_need_a_data_lakehoue/,0.29,False,False,False,False
