id,title,selftext,score,num_comments,author,created_utc,url,upvote_ratio,over_18,edited,spoiler,stickied
1ljq8r4,Unit tests != data quality checks. CMV.,"Unit tests <> data quality checks, for you SQL nerds :P

In post after post, I see people conflating unit/integration/e2e testing with data quality checks. I acknowledge that the concepts have some overlap,  the idea of correctness, but to me they are distinct in practice. 

Unit testing is about making sure that some dependency change or code refactor doesn’t result in bad code that gives wrong results. Integration and e2e testing are about the whole integrated pipeline performing as expected. All of those could, in theory, be written as pytest tests (maybe). It’s a “build time” construct, ie *before* your code is released. 

Data quality checks are about checking the integrity of production data as it’s already flowing, each time it flows. It’s a “runtime” construct, ie *after* your code is released. 

I’m open to changing my mind on this, but I need to  be persuaded. 

",172,27,EarthGoddessDude,2025-06-24 23:20:59,https://www.reddit.com/r/dataengineering/comments/1ljq8r4/unit_tests_data_quality_checks_cmv/,0.94,False,1750807776.0,False,False
1lk96qs,I performed Redshift cost reduction from 60k to 42k,"Optimization: A Deep Dive into Our $60K to $42k/Month Success
As a Redshift DBA, I successfully spearheaded a cost reduction initiative, slashing our monthly spend from a staggering $60,000 to just $42—and we're not stopping there. This significant achievement was driven by a meticulous approach to understanding and optimizing our Redshift environment.
Our key cost optimization techniques included:
 * Strategic DISTKEY and SORTKEY Refinement: We began by thoroughly analyzing all queries to intelligently redefine distribution and sort keys. This fundamental step ensures data is stored and retrieved in the most efficient manner, drastically reducing scan times and I/O.
 * Optimized Workload Management (WLM): By configuring Auto WLM with precise priority settings, we ensured critical queries received the necessary resources while preventing less urgent tasks from monopolizing the system. This balanced approach significantly improved overall cluster efficiency and reduced peak usage costs.
 * User-Centric Query Cost Analysis: We implemented a system to track the 7-day query scan cost percentage change for each user. This provided invaluable insights into individual user query patterns, allowing us to identify and address inefficient query behavior proactively.
 * Proactive Query Monitoring and Anomaly Detection: We meticulously monitored each user's query count and identified slow queries, leveraging generic hash functions for efficient tracking. This allowed us to pinpoint performance bottlenecks and optimize problematic queries before they significantly impacted costs.
 * Centralized Query Validation: To maintain optimal performance and cost efficiency, all new queries are now rigorously reviewed and validated by our DBA team before deployment. This prevents the introduction of inefficient queries that could drive up costs.
 * Regular Table Statistics Updates: We established a routine for updating statistics on all tables. Accurate statistics enable the Redshift query optimizer to generate the most efficient execution plans, leading to faster queries and lower resource consumption.
 * Consistent Table Vacuuming and Sorting: We implemented a strategy for regular VACUUM SORT operations on all tables. This reclaims space and physically reorders data according to sort keys, dramatically improving query performance and reducing scan costs.
 * Time-Series Data Optimization: For time-series data, we focused on sorting tables based on timestamps and creating dedicated time-series tables. This design pattern is highly effective for queries involving time ranges, leading to significant performance gains and cost savings.
 * Focus on Query and Scan Cost over CPU: Our philosophy shifted from merely monitoring CPU utilization to a laser focus on query and scan costs within WLM. We recognized that true optimization lies in reducing the amount of data scanned and processed, rather than just ensuring CPU availability.
 * Aborted Query and Disk I/O Analysis: We actively monitored aborted query counts and analyzed disk I/O scanning costs for each query. Identifying and resolving issues that lead to aborted queries or high I/O contributes directly to cost reduction by minimizing wasted resources.
This comprehensive approach has not only yielded substantial cost savings but has also created a more performant and manageable Redshift environment. We continue to explore new avenues for optimization, committed to maximizing efficiency and minimizing expenditure.",148,61,abhigm,2025-06-25 15:46:39,https://i.redd.it/1yumeosig39f1.jpeg,0.73,False,False,False,False
1lkd2ju,Meta: can we ban any ai generated post?,"it feels super obvious when people drop some slop with text generated from an LLM. Users who post this content should have their first post deleted and further posts banned, imo.",86,15,ThroughTheWire,2025-06-25 18:12:01,https://www.reddit.com/r/dataengineering/comments/1lkd2ju/meta_can_we_ban_any_ai_generated_post/,0.94,False,False,False,False
1lkfghr,I don't enjoy working with AI...do you?,"I've been a Data Engineer for 5 years, with years as an analyst prior. I chose this career path because I really like the puzzle solving element of coding, and being stinking good at data quality analysis. This is the aspect of my job that puts me into a flow state. I also have never been strong with expressing myself with words - this is something I struggle with professionally and personally. It just takes me a long time to fully articulate myself.

My company is SUPER welcoming and open of using AI. I have been willing to use AI and have been finding use cases to use AI more deeply. It's just that...using AI changes the job from coding to automating, and I don't enjoy being an ""automater"" if that makes sense. I don't enjoy writing prompts for AI to then do the stuff that I really like. I'm open to future technological advancements and learning new things - like I don't want to stay comfortable, and I've been making effort. I'm just feeling like even if I get really good at this, I wouldn't like it much...and not sure what this means for my employment in general.  
  
Is anyone else struggling with this? I'm not sure what to do about it, and really don't feel comfortable talking to my peers about this. Surely I can't be the only one?

Going to keep trying in the meantime...",49,22,clueless3867,2025-06-25 19:43:59,https://www.reddit.com/r/dataengineering/comments/1lkfghr/i_dont_enjoy_working_with_aido_you/,0.96,False,False,False,False
1lk39fh,Im exhausted and questioning everything,"I moved from a startup into a corporate job ( digital banking ) a few months ago. I’m from Malaysia , for context. I’m still under probation. And honestly, I don’t know anymore if I’m underperforming, or if I’m just stuck in a dysfunctional culture that burns people out.

In my previous role, I worked as a backend engineer. I had autonomy. Things moved fast. Feedback was immediate. Now, I’m in an environment where expectations are vague, processes are messy, and communication is passive-aggressive.

One example: we have a support schedule to help vendors load data into internal systems. They can’t do it directly, so someone from our side has to run everything manually. It’s basic, repetitive work , I once suggested scripting it to make the process cleaner. That suggestion was ignored. So we keep doing it the hard way.

Recently I got pinged after working hours to join a “5-minute call to load something” , something that would run for 10 hours. There was no advance notice, just the assumption I’d be available. I was already off shift, but even then, the next day came with a passive-aggressive remark: “Didn’t expect this from you.” This wasn’t the first time either.

Then there’s the feedback I’ve been given. My boss told me twice , that I lack “initiative.” The most recent example was over documentation. I was asked to update some system design docs. I did. I even left a comment inside tagging him, asking for input , which should’ve triggered an email notification. But I didn’t follow up in Teams because I got pulled into other work. I was literally about to update him the next morning when he messaged me and immediately launched into a rant about me needing to be more proactive and take ownership. Even though the work had been done. However, sometime he would dished out praise but rarely. 

Meanwhile, I’m putting in 10–15 hour days. I’m exhausted. I forget things. I don’t have any more bandwidth. I’m not even doing meaningful engineering work , just reacting to whatever lands in my inbox or chat window. No ownership, no growth. Just people assuming I’ll pick up anything and everything.

This is starting to affect my personal life. I carry the resentment home. I’m always tired. I’m checked out even when I’m not working. I literally can’t take a shit without being pulled into a meeting.

So now I’m asking: is this a sign I’m not fit for this kind of culture? Am I truly missing something basic? Or is this what happens when you take someone from a fast, transparent, builder-type environment and drop them into a place where nobody wants to own problems , they just want someone to quietly clean up the mess?

If you’ve been through this, I’d appreciate perspective.",20,4,neosisrube,2025-06-25 11:34:10,https://www.reddit.com/r/dataengineering/comments/1lk39fh/im_exhausted_and_questioning_everything/,0.92,False,False,False,False
1lk78ub,"The nightmare of DE, processing free text input data, HELP !","Fellow engineers, here is the case:

You have a dataset of 2 columns id and degrees, with over 1m records coming from free text input box, when i say free text it really means it, the data comes from a forum where candidates fill it with their level of studies or degree, so you can expect anything that the human mind can write there, like typos, instead of typing the degree some typed their field, some their tech stack, some even their GPA, some in other languages like Spanish, typos all over the place

\---------------------------

Sample data:

id, degree

1, technician in public relations

2, bachelor in business management

3, high school diploma

4, php

5, dgree in finance

6, masters in cs

7, mstr in logisticss

\----------------------------------

The goal is to add an extra column category which will have the correct official equivalent degree to each line

Sample data of the goal output:

  
\--------------------------

id, degree, category

1, technician in public relations, vocacional degree in public relations

2, bachelor in business management, bachelors degree in business management

3, high school diploma, high school

4, php, degree in computer science

5, dgree in finance, degree in finance

6, masters in cs,  masters degree in computer science

7, mstr in logisticss, masters degree in logistics

\---------------------------------  


What i have thought of in creating a master table with all the official degrees, then joining it to the dataset, but since the records are free text input very very few records will even match in the join

What approach, ideas, methods you would implement to resolve this buzzle ?",17,23,HMZ_PBI,2025-06-25 14:31:19,https://www.reddit.com/r/dataengineering/comments/1lk78ub/the_nightmare_of_de_processing_free_text_input/,0.92,False,False,False,False
1ljsy5p,Whats your Data Stack for Takehomes?,Just that. When you do a takehome assignment for a job application what does your stack look like. I spin up a local postgres in docker and boot up a dbt project but I hate having to live outside of my normal BI tool for visualization / analytics work. ,9,11,TacoTuesday69_420,2025-06-25 01:28:45,https://www.reddit.com/r/dataengineering/comments/1ljsy5p/whats_your_data_stack_for_takehomes/,1.0,False,False,False,False
1lk803u,How are you tracking data freshness / latency across tools like Fivetran + dbt?,"We’re using Fivetran to sync data from sources like CommerceTools into a Postgres warehouse. Then we have dbt building out models, and Airflow orchestrating everything.

What I want is a smart way to monitor data latency; like, how long it takes from when data is updated in the source system to when it shows up in our golden layer (final dbt models). We will be haiving SLAs for that.

I'm planning to write a python script that pulls timestamps from both the source systems and our DWH, compares them, and tracks the latency end-to-end. It'll run outside of Airflow because our scheduler can go down, and we don’t have monitoring in place for that yet (that’s a discussion for another day...).

How do you track freshness or latency e2e > from source to your final models?

Would love to hear any setups, hacks, or horror stories...  
Thank you

EDIT : we are using PostgreSQL as DWH -- and dbt freshness is not supported on that adaptor ",5,6,Aggressive-Practice3,2025-06-25 15:01:00,https://www.reddit.com/r/dataengineering/comments/1lk803u/how_are_you_tracking_data_freshness_latency/,0.79,False,1750864184.0,False,False
1lk7y3r,Looking for a Dedicated Data Engineering Study Partner,"Hi I have 3+ experience in IT female, trying for switch and , now started learning data engineering subjects mainly Pyspark, ETL, Cloud, Pandas, Hive. If anyone interested to study with me please message. Serious study partners only allowed. Every day without fail two hours study sessions. ",6,62,IllMathematician6297,2025-06-25 14:58:56,https://www.reddit.com/r/dataengineering/comments/1lk7y3r/looking_for_a_dedicated_data_engineering_study/,0.62,False,False,False,False
1lk01f2,Extracting redirects from a HAR file,,6,0,JumbleGuide,2025-06-25 08:16:29,https://medium.com/@heyda/extracting-redirects-from-a-har-file-f559af373877,0.88,False,False,False,False
1lk7ah5,"Trino + iceberg + hive metastore setup, trino not writing tables","Hey, since there's not much resources on this topic (at least I couldn't find what i wanted), I'll ask here, here's the situation I'm in:  
I've set up trino coordinator and worker on 2 separate servers, I've got 1 storage server for Iceberg, and 1 server for hive catalog. Since all these servers are in LAN, storage is mounted via nfs on both trino worker and coordinator and hive catalog server. When I create table from trino, It creates it, and acts as a success, even when later i insert values into it and select it, it acts as everything is normal, even selecting .""table$files"" works as expected showing correct path. But when I check the path its meant to be writing into, its empty. as I create a table, an empty folder with table name and uuid is created, but no data/metadata inside. Most likely it is being cached somewhere, because if i reboot the trino server (and not restart trino, bcz that does not change it), the message says: 

Query <id> failed: Metadata not found in metadata location for table <table\_name>

but cant create same table before I drop current one. BTW, dropping the table is also success, but does not remove the folder from the original storage. (the empty folder it creates)

Please help me, I'm about to burn this place down and migrate to different country.",4,2,Sharmazan,2025-06-25 14:33:11,https://www.reddit.com/r/dataengineering/comments/1lk7ah5/trino_iceberg_hive_metastore_setup_trino_not/,1.0,False,False,False,False
1lk0xyh,SaaS builds a new API for each individual integration,"Have you ever encountered anything like this? So instead of maintaining one good API they develop a custom API for each integration. They'll also add only what's the absolute minimum. How are they going to maintain all that mess?  

They also think the API doesn't need any sorting or filtering and querying millions of rows daily is fine even though the rate limiting doesn't allow it. To me the point of an API is that it serves all the common use cases and is a pretty universal way to interface with the system. I think they are making things difficult on purpose and artificially creating themselves billable hours. ",4,1,dfwtjms,2025-06-25 09:17:34,https://www.reddit.com/r/dataengineering/comments/1lk0xyh/saas_builds_a_new_api_for_each_individual/,0.76,False,False,False,False
1lkd8ms,Looking for a motivated partner to start working on real-time project?,"

Hey everyone,

I’m currently looking for a teammate to work together on a project. The idea is to collaborate, learn from each other, and build something meaningful — whether it’s for a hackathon, portfolio, startup idea, or just for fun and skill-building.

What I’m Looking For:
1.Someone reliable and open to collaborating regularly
2.Ideally with complementary skills (but not a strict requirement)
3.Passion for building and learning — beginner or experienced, both welcome!
4.I'm Currently in CST and can prefer working with any of the US time zones.
5.And also Looking for someone who can guide us to start building projects.
",3,11,Tall_Ad_8216,2025-06-25 18:18:29,https://www.reddit.com/r/dataengineering/comments/1lkd8ms/looking_for_a_motivated_partner_to_start_working/,0.67,False,1750880720.0,False,False
1lk5ld7,lakeFS Iceberg REST Catalog: Data Version Control for Structured Data,This is a key addition from the Treeverse team and well timed for the end of the OTF wars. Iceberg has won and data version control needs to operate at scale and against structured data. ,3,0,jtsymonds,2025-06-25 13:24:37,https://lakefs.io/blog/lakefs-iceberg-rest-catalog/,0.81,False,False,False,False
1lk5efs,Dear data engineer ( asking help for a junior ),"Dear friends, I recently finished my evening course for Data Analytics while doing 40 hour work week as a front end dev.

I was very unhappy as a webdev since the work pressure was really high and I couldn’t keep with while trying to develop my skills.

I deeply enjoyed my data analytics course ( Learned Powerbi, SSMS already knew some SQL, general DWH / ETL )

This month ( start of june ) I started as a BI specialist, ( fancy word for Data engineer ). It has significantly less powerbi than I expected and is actually 80% modelling / DWH work.

There isn’t any direct Data employee, they have a consultant that visits once every 2 weeks and I can contact him online. When he’s teaching me he’s very helpful and I learn a lot. But like any consultant he’s incredibly bizzy as per usual.

There is so much I still need to learn and realize. I am 22, and super willing to learn more in my free time, luckily my work environment isn’t soulcrushing but I want to make something of the opportunity. So far my work has provided me with udemy and I’m also going to get DataCamp. Still I was wondering if any of you guys had advice for me to improve myself and become a worthy Data engineer / data guy.

Since right now it almost feels like starting as junior dev again that doesn’t know crap. But I’m motivated to work to get past that point. I just get the feeling it might not come from just doing my best at my workplace, just like when I was working as a webdev. I don’t want to fall behind my age <=> expected skill level

Wish you guys a good day and thank you for whatever advice you can help me out with.

Hope to have a long and succesful career in data :)",5,10,Fluffy-Moose6907,2025-06-25 13:16:17,https://www.reddit.com/r/dataengineering/comments/1lk5efs/dear_data_engineer_asking_help_for_a_junior/,0.73,False,False,False,False
1lkg30u,Remote/freelance as a data engineer,"Hi everyone, Lately i've decided that I want to work remotely in the data engineering field

I wanted to see if anyone here have experience as a freelance / remote role 

The internet shows all the signs that it's almost impossible/very very hard to do without connections to companies and projects but also the internet loves being discouragous

how hard is it to find projects as a remote data engineer freelancer? (part time / contract)

how hard is it to find a remote role in general? (full time)

has anyone here done this process lately and can give any tips / ideas?   
I've heard its generally hard to find remote roles especially in this field because its less of a ""project based"" role.

  
for context - I have 5 years of experience in the field with python/pyspark/aws/azure/databricks/sql as my main skills

  
thanks in advance to anyone who can help shed some light on this!",3,2,roey132,2025-06-25 20:08:28,https://www.reddit.com/r/dataengineering/comments/1lkg30u/remotefreelance_as_a_data_engineer/,1.0,False,False,False,False
1lkalnw,Request for Architecture Review – Talend ESB High-Volume XML Processing,"
Hello,

In my current role, I’ve taken over a data exchange system handling approximately 50,000 transactions per day. I’m seeking your input or suggestions for a modernized architecture using the following technologies:
	•	Talend ESB
	•	ActiveMQ
	•	PostgreSQL

Current Architecture:

1.	Input
The system exposes 10 REST/SOAP APIs to receive data structured around a core XML (id, field1, field2, xml, etc.). Each API performs two actions:
	•	Inserts the data into the PostgreSQL database
	•	Sends the id to an ActiveMQ queue for downstream processing

2.	Transformation
A job retrieves the XML and transforms it into a generic XML format using XSLT.

3.	Target Eligibility
The system evaluates the eligibility of the data for 30 possible target applications by calling 30 separate APIs (Talend ESB API). Each API:
	•	Analyzes the generic XML and returns a boolean (true/false)
	•	If eligible, publishes the id to the corresponding ActiveMQ queue
	•	The responses are aggregated into a JSON object:

{
  ""target1"": true,
  ...
  ""target30"": false
}

This JSON is then stored in the database.

4.	Distribution
One job per target reads its corresponding ActiveMQ queue and routes the data to the target system via the appropriate protocol (database, email, etc.)

Main Issue:
This architecture struggles under high load due to the volume of API calls (30 per transaction).

I would appreciate your feedback or suggestions for improving and modernizing this pipeline.",2,3,Plane_Expression2000,2025-06-25 16:39:38,https://www.reddit.com/r/dataengineering/comments/1lkalnw/request_for_architecture_review_talend_esb/,0.76,False,False,False,False
1lka20n,Data Engineering for Gen AI?,"I'm not talking about Gen AI doing data engineering work... specifically what does data engineering look like for supporting Gen AI services/products?

Below are a few thoughts from what i've seen in the market and my own building; but I would love to hear what others are seeing!

1. A key differentiator for quality LLM output is providing it great context, thus the role of information organization, data mining, and information retrieval is becoming more important. With that said, I don't see traditional data modeling fully fitting this paradigm given that the relationship are much more flexible with LLMs. Something I'm thinking about is what are identifiers around ""text themes"" an modeling around that (I could 100% be over complicating this though).

2. I think security and governance controls are going to become more important in data engineering. Before LLMs, it was pretty hard to expose sensitive data without gross negligence. Today with consumer focused AI, people are sending PII to these AI tools that are then sending it to their external APIs (especially among non-technical users). I think people will come to their senses soon, but the barriers of protection via processes and training have been eroded substantially with the easy adoption of AI.

3. Data integrations with third parties is going to become trivial. For example, say you don't have budget for Fivetran and have to build your own connection from Salesforce to your data warehouse. The process of going through API docs, building a pipeline, parsing nested JSON, dealing with edge cases, etc takes a long time. I see a move towards offloading this work to AI ""agents"" (loaded term now I know), but essentially I'm seeing traction with MCP server. So data eng work is less around building data models for other humans, but instead for external AI agents to work with.

Is this matching what you are seeing?

edit: typos",2,4,on_the_mark_data,2025-06-25 16:19:29,https://www.reddit.com/r/dataengineering/comments/1lka20n/data_engineering_for_gen_ai/,0.67,False,False,False,False
1lk96w3,How to hire your first data engineer (and when not to),,2,0,ivanovyordan,2025-06-25 15:46:48,https://open.substack.com/pub/datagibberish/p/how-to-hire-your-first-data-engineer?utm_source=share&utm_medium=android&r=odlo3,0.76,False,False,False,False
