id,title,score,num_comments,author,created_utc,url,over_18,edited,spoiler,stickied
1ln8qj0,Influencers ruin expectations,134,66,vuncentV7,2025-06-29 07:24:20,https://www.reddit.com/r/dataengineering/comments/1ln8qj0/influencers_ruin_expectations/,False,False,False,False
1lnphtn,[META] Thank you mods for being on top of reports lately!,44,4,Green_Gem_,2025-06-29 21:01:35,https://www.reddit.com/r/dataengineering/comments/1lnphtn/meta_thank_you_mods_for_being_on_top_of_reports/,False,False,False,False
1ln3fmo,Mongo v Postgres: Active-Active,16,7,sir_clutch_666,2025-06-29 02:04:08,https://www.reddit.com/r/dataengineering/comments/1ln3fmo/mongo_v_postgres_activeactive/,False,False,False,False
1lni5eo,High concurrency Spark?,12,9,rectalrectifier,2025-06-29 15:59:04,https://www.reddit.com/r/dataengineering/comments/1lni5eo/high_concurrency_spark/,False,False,False,False
1lneleg,Demystify the differences between MQTT/AMQP/NATS/Kafka,7,0,Commercial_Dig2401,2025-06-29 13:23:31,https://www.reddit.com/r/dataengineering/comments/1lneleg/demystify_the_differences_between/,False,False,False,False
1lnbvf5,How do you streamline massive experimental datasets?,5,3,LAWOFBJECTIVEE,2025-06-29 10:54:26,https://www.reddit.com/r/dataengineering/comments/1lnbvf5/how_do_you_streamline_massive_experimental/,False,False,False,False
1ln8x2i,Where do I start in big data,7,12,turbulentsoap,2025-06-29 07:36:29,https://www.reddit.com/r/dataengineering/comments/1ln8x2i/where_do_i_start_in_big_data/,False,False,False,False
1ln8btf,Trouble performing a database migration at work: ERP Service exports .dom file and database .db is actually a Matlab v4 file,7,11,EvilSonidow,2025-06-29 06:57:20,https://www.reddit.com/r/dataengineering/comments/1ln8btf/trouble_performing_a_database_migration_at_work/,False,False,False,False
1ln7zcm,Tutorials on Ducklake,2,1,autodidact2016,2025-06-29 06:34:14,https://www.reddit.com/r/dataengineering/comments/1ln7zcm/tutorials_on_ducklake/,False,False,False,False
1ln86ut,Senior data engineer working to build ai pipelines vs data architect role. Which role is more future proof from a ai point of view?,0,8,gooner4lifejoe,2025-06-29 06:48:05,https://www.reddit.com/r/dataengineering/comments/1ln86ut/senior_data_engineer_working_to_build_ai/,False,False,False,False
1lneqql,What's your thoughts on this video (Data Engineering is Dead (Or how we can use Ai to Avoid it)),0,5,maz_dex,2025-06-29 13:30:38,https://www.reddit.com/r/dataengineering/comments/1lneqql/whats_your_thoughts_on_this_video_data/,False,False,False,False
1lnlm3k,Would you use a tool to build data pipelines by chatting—no infra setup?,0,6,DependentAside9548,2025-06-29 18:20:09,https://www.reddit.com/r/dataengineering/comments/1lnlm3k/would_you_use_a_tool_to_build_data_pipelines_by/,False,False,False,False
1ln4zb1,Looking for a Rust-Curious Data Enthusiast to Rewrite dbt in Rust,0,12,CompetitiveWealth503,2025-06-29 03:31:21,https://www.reddit.com/r/dataengineering/comments/1ln4zb1/looking_for_a_rustcurious_data_enthusiast_to/,False,False,False,False
